{
  "schema_version":"goal_patch_v1",
  "patch_id":"SP003-GP-001",
  "base_goal_id":"SP-003",
  "base_revision":"2",
  "base_digest":"5070343925a81a3fffefd63e9d47575e3138e5b8daeb3467b5bb88dfc42291bf",
  "sequence":1,
  "target_section":"implementation_ladder",
  "replacement":[
    {"id":"S-016","outcome":"冻结双仓 source-of-truth、public content boundary、maintainer/end-user surface 与负例合同","readiness":"ready"},
    {"id":"S-017","outcome":"实现或修订维护者 fresh-root exact-allowlist export、residue scan、tree diff 与 projection manifest","readiness":"ready_after_dependencies"},
    {"id":"S-018","outcome":"实现公开仓 clone/install/doctor/upgrade/backup/install-record/recoverable-uninstall 用户路径","readiness":"ready_after_dependencies"},
    {"id":"S-019","outcome":"冻结 revision/candidate/projection/tag/release identity 与 GitHub permission/authorization matrix","readiness":"ready_after_dependencies"},
    {"id":"S-020","outcome":"实现并验证 external PR -> private canonical -> re-export -> independent validation 回流流程","readiness":"ready_after_dependencies"},
    {"id":"S-021","outcome":"完成 clean-room maintainer/end-user UAT、ERBE RED/GREEN 与独立 Validation/Semantic Review","readiness":"ready_after_dependencies"},
    {"id":"S-022","outcome":"完成 OPCM、中文 closeout、release decision boundary 与 post-closeout reconciliation","readiness":"ready_after_dependencies"}
  ],
  "reason":"将 Stage Plan 的连续 Session DAG 解析为可执行的最小安全切片与完整实现阶梯，明确 S-016 是入口而不是 Goal 终止条件。",
  "scope_delta":"none",
  "approval_ref":null,
  "conflicts_with":[]
}
